{"id":"ganesha.ashtottara","deity":"ganesha","type":"ashtottara","unit":"reading","status":"draft","title":{"te":"శ్రీ గణేశ అష్టోత్తర శతనామావళి","hi":"श्री गणेश अष्टोत्तर शतनामावली","en":"Ganesha Ashtottara (108 names)"},"audio":{"file":"ganesha.ashtottara.mp3","intro_ms":8000,"slot_ms":3500},"round":null,"mantra":null,"names":[{"id":"ganesha.ashtottara.001","n":1,"text":{"sa":"ॐ गजाननाय नमः","iast":"oṃ gajānanāya namaḥ","te":"ఓం గజాననాయ నమః"},"flag":null},{"id":"ganesha.ashtottara.002","n":2,"text":{"sa":"ॐ गणाध्यक्षाय नमः","iast":"oṃ gaṇādhyakṣāya namaḥ","te":"ఓం గణాధ్యక్షాయ నమః"},"flag":null},{"id":"ganesha.ashtottara.003","n":3,"text":{"sa":"ॐ विघ्नराजाय नमः","iast":"oṃ vighnarājāya namaḥ","te":"ఓం విఘ్నరాజాయ నమః"},"flag":null},{"id":"ganesha.ashtottara.004","n":4,"text":{"sa":"ॐ विघ्नेश्वराय नमः","iast":"oṃ vighneśvarāya namaḥ","te":"ఓం విఘ్నేశ్వరాయ నమః"},"flag":null},{"id":"ganesha.ashtottara.005","n":5,"text":{"sa":"ॐ द्वैमातुराय नमः","iast":"oṃ dvaimāturāya namaḥ","te":"ఓం ద్వైమాతురాయ నమః"},"flag":null},{"id":"ganesha.ashtottara.006","n":6,"text":{"sa":"ॐ द्विमुखाय नमः","iast":"oṃ dvimukhāya namaḥ","te":"ఓం ద్విముఖాయ నమః"},"flag":null},{"id":"ganesha.ashtottara.007","n":7,"text":{"sa":"ॐ प्रमुखाय नमः","iast":"oṃ pramukhāya namaḥ","te":"ఓం ప్రముఖాయ నమః"},"flag":null},{"id":"ganesha.ashtottara.008","n":8,"text":{"sa":"ॐ सुमुखाय नमः","iast":"oṃ sumukhāya namaḥ","te":"ఓం సుముఖాయ నమః"},"flag":null},{"id":"ganesha.ashtottara.009","n":9,"text":{"sa":"ॐ कृतिने नमः","iast":"oṃ kṛtine namaḥ","te":"ఓం కృతినే నమః"},"flag":null},{"id":"ganesha.ashtottara.010","n":10,"text":{"sa":"ॐ सुप्रदीप्ताय नमः","iast":"oṃ supradīptāya namaḥ","te":"ఓం సుప్రదీప్తాయ నమః"},"flag":"VARIANT"},{"id":"ganesha.ashtottara.011","n":11,"text":{"sa":"ॐ सुखनिधये नमः","iast":"oṃ sukhanidhaye namaḥ","te":"ఓం సుఖనిధయే నమః"},"flag":null},{"id":"ganesha.ashtottara.012","n":12,"text":{"sa":"ॐ सुराध्यक्षाय नमः","iast":"oṃ surādhyakṣāya namaḥ","te":"ఓం సురాధ్యక్షాయ నమః"},"flag":null},{"id":"ganesha.ashtottara.013","n":13,"text":{"sa":"ॐ सुरारिघ्नाय नमः","iast":"oṃ surārighnāya namaḥ","te":"ఓం సురారిఘ్నాయ నమః"},"flag":null},{"id":"ganesha.ashtottara.014","n":14,"text":{"sa":"ॐ महागणपतये नमः","iast":"oṃ mahāgaṇapataye namaḥ","te":"ఓం మహాగణపతయే నమః"},"flag":null},{"id":"ganesha.ashtottara.015","n":15,"text":{"sa":"ॐ मान्याय नमः","iast":"oṃ mānyāya namaḥ","te":"ఓం మాన్యాయ నమః"},"flag":null},{"id":"ganesha.ashtottara.016","n":16,"text":{"sa":"ॐ महाकालाय नमः","iast":"oṃ mahākālāya namaḥ","te":"ఓం మహాకాలాయ నమః"},"flag":null},{"id":"ganesha.ashtottara.017","n":17,"text":{"sa":"ॐ महाबलाय नमः","iast":"oṃ mahābalāya namaḥ","te":"ఓం మహాబలాయ నమః"},"flag":null},{"id":"ganesha.ashtottara.018","n":18,"text":{"sa":"ॐ हेरम्बाय नमः","iast":"oṃ herambāya namaḥ","te":"ఓం హేరమ్బాయ నమః"},"flag":null},{"id":"ganesha.ashtottara.019","n":19,"text":{"sa":"ॐ लम्बजठराय नमः","iast":"oṃ lambajaṭharāya namaḥ","te":"ఓం లమ్బజఠరాయ నమః"},"flag":null},{"id":"ganesha.ashtottara.020","n":20,"text":{"sa":"ॐ ह्रस्वग्रीवाय नमः","iast":"oṃ hrasvagrīvāya namaḥ","te":"ఓం హ్రస్వగ్రీవాయ నమః"},"flag":null},{"id":"ganesha.ashtottara.021","n":21,"text":{"sa":"ॐ प्रथमाय नमः","iast":"oṃ prathamāya namaḥ","te":"ఓం ప్రథమాయ నమః"},"flag":null},{"id":"ganesha.ashtottara.022","n":22,"text":{"sa":"ॐ प्राज्ञाय नमः","iast":"oṃ prājñāya namaḥ","te":"ఓం ప్రాజ్ఞాయ నమః"},"flag":null},{"id":"ganesha.ashtottara.023","n":23,"text":{"sa":"ॐ प्रमोदाय नमः","iast":"oṃ pramodāya namaḥ","te":"ఓం ప్రమోదాయ నమః"},"flag":null},{"id":"ganesha.ashtottara.024","n":24,"text":{"sa":"ॐ मोदकप्रियाय नमः","iast":"oṃ modakapriyāya namaḥ","te":"ఓం మోదకప్రియాయ నమః"},"flag":null},{"id":"ganesha.ashtottara.025","n":25,"text":{"sa":"ॐ विघ्नकर्त्रे नमः","iast":"oṃ vighnakartre namaḥ","te":"ఓం విఘ్నకర్త్రే నమః"},"flag":null},{"id":"ganesha.ashtottara.026","n":26,"text":{"sa":"ॐ विघ्नहन्त्रे नमः","iast":"oṃ vighnahantre namaḥ","te":"ఓం విఘ్నహన్త్రే నమః"},"flag":null},{"id":"ganesha.ashtottara.027","n":27,"text":{"sa":"ॐ विश्वनेत्रे नमः","iast":"oṃ viśvanetre namaḥ","te":"ఓం విశ్వనేత్రే నమః"},"flag":null},{"id":"ganesha.ashtottara.028","n":28,"text":{"sa":"ॐ विराट्पतये नमः","iast":"oṃ virāṭpataye namaḥ","te":"ఓం విరాట్పతయే నమః"},"flag":null},{"id":"ganesha.ashtottara.029","n":29,"text":{"sa":"ॐ श्रीपतये नमः","iast":"oṃ śrīpataye namaḥ","te":"ఓం శ్రీపతయే నమః"},"flag":null},{"id":"ganesha.ashtottara.030","n":30,"text":{"sa":"ॐ वाक्पतये नमः","iast":"oṃ vākpataye namaḥ","te":"ఓం వాక్పతయే నమః"},"flag":null},{"id":"ganesha.ashtottara.031","n":31,"text":{"sa":"ॐ शृङ्गारिणे नमः","iast":"oṃ śṛṅgāriṇe namaḥ","te":"ఓం శృఙ్గారిణే నమః"},"flag":null},{"id":"ganesha.ashtottara.032","n":32,"text":{"sa":"ॐ आश्रितवत्सलाय नमः","iast":"oṃ āśritavatsalāya namaḥ","te":"ఓం ఆశ్రితవత్సలాయ నమః"},"flag":null},{"id":"ganesha.ashtottara.033","n":33,"text":{"sa":"ॐ शिवप्रियाय नमः","iast":"oṃ śivapriyāya namaḥ","te":"ఓం శివప్రియాయ నమః"},"flag":null},{"id":"ganesha.ashtottara.034","n":34,"text":{"sa":"ॐ शीघ्रकारिणे नमः","iast":"oṃ śīghrakāriṇe namaḥ","te":"ఓం శీఘ్రకారిణే నమః"},"flag":null},{"id":"ganesha.ashtottara.035","n":35,"text":{"sa":"ॐ शाश्वताय नमः","iast":"oṃ śāśvatāya namaḥ","te":"ఓం శాశ్వతాయ నమః"},"flag":null},{"id":"ganesha.ashtottara.036","n":36,"text":{"sa":"ॐ बलान्विताय नमः","iast":"oṃ balānvitāya namaḥ","te":"ఓం బలాన్వితాయ నమః"},"flag":"CORRECTED"},{"id":"ganesha.ashtottara.037","n":37,"text":{"sa":"ॐ बलोद्धताय नमः","iast":"oṃ baloddhatāya namaḥ","te":"ఓం బలోద్ధతాయ నమః"},"flag":"CORRECTED"},{"id":"ganesha.ashtottara.038","n":38,"text":{"sa":"ॐ भक्तनिधये नमः","iast":"oṃ bhaktanidhaye namaḥ","te":"ఓం భక్తనిధయే నమః"},"flag":null},{"id":"ganesha.ashtottara.039","n":39,"text":{"sa":"ॐ भावगम्याय नमः","iast":"oṃ bhāvagamyāya namaḥ","te":"ఓం భావగమ్యాయ నమః"},"flag":null},{"id":"ganesha.ashtottara.040","n":40,"text":{"sa":"ॐ भवात्मजाय नमः","iast":"oṃ bhavātmajāya namaḥ","te":"ఓం భవాత్మజాయ నమః"},"flag":"CORRECTED"},{"id":"ganesha.ashtottara.041","n":41,"text":{"sa":"ॐ अग्रगामिने नमः","iast":"oṃ agragāmine namaḥ","te":"ఓం అగ్రగామినే నమః"},"flag":null},{"id":"ganesha.ashtottara.042","n":42,"text":{"sa":"ॐ मन्त्रकृते नमः","iast":"oṃ mantrakṛte namaḥ","te":"ఓం మన్త్రకృతే నమః"},"flag":null},{"id":"ganesha.ashtottara.043","n":43,"text":{"sa":"ॐ चामीकरप्रभाय नमः","iast":"oṃ cāmīkaraprabhāya namaḥ","te":"ఓం చామీకరప్రభాయ నమః"},"flag":null},{"id":"ganesha.ashtottara.044","n":44,"text":{"sa":"ॐ सर्वाय नमः","iast":"oṃ sarvāya namaḥ","te":"ఓం సర్వాయ నమః"},"flag":null},{"id":"ganesha.ashtottara.045","n":45,"text":{"sa":"ॐ सर्वोपास्याय नमः","iast":"oṃ sarvopāsyāya namaḥ","te":"ఓం సర్వోపాస్యాయ నమః"},"flag":null},{"id":"ganesha.ashtottara.046","n":46,"text":{"sa":"ॐ सर्वकर्त्रे नमः","iast":"oṃ sarvakartre namaḥ","te":"ఓం సర్వకర్త్రే నమః"},"flag":null},{"id":"ganesha.ashtottara.047","n":47,"text":{"sa":"ॐ सर्वनेत्रे नमः","iast":"oṃ sarvanetre namaḥ","te":"ఓం సర్వనేత్రే నమః"},"flag":null},{"id":"ganesha.ashtottara.048","n":48,"text":{"sa":"ॐ सर्वसिद्धिप्रदाय नमः","iast":"oṃ sarvasiddhipradāya namaḥ","te":"ఓం సర్వసిద్ధిప్రదాయ నమః"},"flag":null},{"id":"ganesha.ashtottara.049","n":49,"text":{"sa":"ॐ सर्वसिद्धये नमः","iast":"oṃ sarvasiddhaye namaḥ","te":"ఓం సర్వసిద్ధయే నమః"},"flag":null},{"id":"ganesha.ashtottara.050","n":50,"text":{"sa":"ॐ पञ्चहस्ताय नमः","iast":"oṃ pañcahastāya namaḥ","te":"ఓం పఞ్చహస్తాయ నమః"},"flag":null},{"id":"ganesha.ashtottara.051","n":51,"text":{"sa":"ॐ पार्वतीनन्दनाय नमः","iast":"oṃ pārvatīnandanāya namaḥ","te":"ఓం పార్వతీనన్దనాయ నమః"},"flag":null},{"id":"ganesha.ashtottara.052","n":52,"text":{"sa":"ॐ प्रभवे नमः","iast":"oṃ prabhave namaḥ","te":"ఓం ప్రభవే నమః"},"flag":null},{"id":"ganesha.ashtottara.053","n":53,"text":{"sa":"ॐ कुमारगुरवे नमः","iast":"oṃ kumāragurave namaḥ","te":"ఓం కుమారగురవే నమః"},"flag":null},{"id":"ganesha.ashtottara.054","n":54,"text":{"sa":"ॐ कुञ्जरासुरभञ्जनाय नमः","iast":"oṃ kuñjarāsurabhañjanāya namaḥ","te":"ఓం కుఞ్జరాసురభఞ్జనాయ నమః"},"flag":null},{"id":"ganesha.ashtottara.055","n":55,"text":{"sa":"ॐ कान्तिमते नमः","iast":"oṃ kāntimate namaḥ","te":"ఓం కాన్తిమతే నమః"},"flag":null},{"id":"ganesha.ashtottara.056","n":56,"text":{"sa":"ॐ धृतिमते नमः","iast":"oṃ dhṛtimate namaḥ","te":"ఓం ధృతిమతే నమః"},"flag":null},{"id":"ganesha.ashtottara.057","n":57,"text":{"sa":"ॐ कामिने नमः","iast":"oṃ kāmine namaḥ","te":"ఓం కామినే నమః"},"flag":null},{"id":"ganesha.ashtottara.058","n":58,"text":{"sa":"ॐ कपित्थफलप्रियाय नमः","iast":"oṃ kapitthaphalapriyāya namaḥ","te":"ఓం కపిత్థఫలప్రియాయ నమః"},"flag":null},{"id":"ganesha.ashtottara.059","n":59,"text":{"sa":"ॐ ब्रह्मचारिणे नमः","iast":"oṃ brahmacāriṇe namaḥ","te":"ఓం బ్రహ్మచారిణే నమః"},"flag":null},{"id":"ganesha.ashtottara.060","n":60,"text":{"sa":"ॐ ब्रह्मरूपिणे नमः","iast":"oṃ brahmarūpiṇe namaḥ","te":"ఓం బ్రహ్మరూపిణే నమః"},"flag":null},{"id":"ganesha.ashtottara.061","n":61,"text":{"sa":"ॐ महोदराय नमः","iast":"oṃ mahodarāya namaḥ","te":"ఓం మహోదరాయ నమః"},"flag":null},{"id":"ganesha.ashtottara.062","n":62,"text":{"sa":"ॐ मदोत्कटाय नमः","iast":"oṃ madotkaṭāya namaḥ","te":"ఓం మదోత్కటాయ నమః"},"flag":null},{"id":"ganesha.ashtottara.063","n":63,"text":{"sa":"ॐ महावीराय नमः","iast":"oṃ mahāvīrāya namaḥ","te":"ఓం మహావీరాయ నమః"},"flag":null},{"id":"ganesha.ashtottara.064","n":64,"text":{"sa":"ॐ मन्त्रिणे नमः","iast":"oṃ mantriṇe namaḥ","te":"ఓం మన్త్రిణే నమః"},"flag":null},{"id":"ganesha.ashtottara.065","n":65,"text":{"sa":"ॐ मङ्गलसुस्वराय नमः","iast":"oṃ maṅgalasusvarāya namaḥ","te":"ఓం మఙ్గలసుస్వరాయ నమః"},"flag":"SCRIPT"},{"id":"ganesha.ashtottara.066","n":66,"text":{"sa":"ॐ प्रमदाय नमः","iast":"oṃ pramadāya namaḥ","te":"ఓం ప్రమదాయ నమః"},"flag":null},{"id":"ganesha.ashtottara.067","n":67,"text":{"sa":"ॐ ज्यायसे नमः","iast":"oṃ jyāyase namaḥ","te":"ఓం జ్యాయసే నమః"},"flag":null},{"id":"ganesha.ashtottara.068","n":68,"text":{"sa":"ॐ यक्षकिन्नरसेविताय नमः","iast":"oṃ yakṣakinnarasevitāya namaḥ","te":"ఓం యక్షకిన్నరసేవితాయ నమః"},"flag":null},{"id":"ganesha.ashtottara.069","n":69,"text":{"sa":"ॐ गङ्गासुताय नमः","iast":"oṃ gaṅgāsutāya namaḥ","te":"ఓం గఙ్గాసుతాయ నమః"},"flag":null},{"id":"ganesha.ashtottara.070","n":70,"text":{"